User Input,Chatbot Response,Timestamp
hello,Hi there,2024-09-10 01:21:51
how are you ,My purpose is to assist you,2024-09-10 01:21:57
weather ,"I'm sorry, I cannot provide real-time weather information.",2024-09-10 01:22:20
How do I create a budget,"To make a budget, start by tracking your income and expenses. Then, allocate your income towards essential expenses like rent, food, and bills. Next, allocate some of your income towards savings and debt repayment. Finally, allocate the remainder of your income towards discretionary expenses like entertainment and hobbies.",2024-09-10 01:22:30
Today is a nice weather,"I'm sorry, I cannot provide real-time weather information.",2024-10-03 08:29:52
How's the weather today,"I'm sorry, I cannot provide real-time weather information.",2024-10-03 08:30:47
Hi,Hello,2024-10-03 08:30:56
hii,"Gardening tips include choosing the right plants for your climate, watering properly, and using organic fertilizers.",2024-12-09 16:26:05
Hii,"Gardening tips include choosing the right plants for your climate, watering properly, and using organic fertilizers.",2024-12-09 16:26:17
Hello there,Hey,2024-12-09 16:26:32
how are you,Nothing much,2024-12-09 16:26:44
how is weather in indida,"Mindfulness is the practice of being fully present in the moment, observing thoughts and feelings without judgment.",2024-12-09 16:27:19
how is weather in india,"Mindfulness is the practice of being fully present in the moment, observing thoughts and feelings without judgment.",2024-12-09 16:27:24
Can you help me,I'm here to help. What's the problem?,2024-12-09 16:28:30
how to create a budget,"Mindfulness techniques include meditation, deep breathing, body scanning, and mindful eating.",2024-12-09 16:28:42
movies,"As an AI, I don't watch movies, but I can suggest some popular ones like The Shawshank Redemption, Inception, or The Godfather.",2024-12-09 16:29:09
movie,"As an AI, I don't watch movies, but I can suggest some popular ones like The Shawshank Redemption, Inception, or The Godfather.",2024-12-09 16:29:31
moviea,Growing a vegetable garden allows you to enjoy fresh produce and connect with nature.,2024-12-09 16:29:35
movies,"I may not have personal preferences, but I can help you find movies based on your taste!",2024-12-09 16:29:38
please recommend some movies,"As an AI, I don't watch movies, but I can suggest some popular ones like The Shawshank Redemption, Inception, or The Godfather.",2024-12-09 16:29:58
Hii there,Growing a vegetable garden allows you to enjoy fresh produce and connect with nature.,2024-12-10 20:14:01
hii,"Gardening tips include choosing the right plants for your climate, watering properly, and using organic fertilizers.",2024-12-10 20:14:11
Hii,Growing a vegetable garden allows you to enjoy fresh produce and connect with nature.,2024-12-10 20:14:20
Hello,Hey,2024-12-10 20:14:31
Hello,Hi there,2024-12-10 20:14:41
How to study ,"Mindfulness techniques include meditation, deep breathing, body scanning, and mindful eating.",2024-12-10 20:26:09
How to stay Healthy,"Fitness is essential for overall well-being and can improve your mood, energy levels, and longevity.",2024-12-10 20:26:34
How to stay healthy,"To stay healthy, maintain a balanced diet, engage in regular physical activity, get enough sleep, manage stress, and avoid harmful habits.",2024-12-10 20:27:00
